{
  "principle_id": "op-003",
  "role": "shared",
  "title": "Protect downside before forcing growth",
  "statement": "Do not take irreversible risk just to preserve momentum or narrative.",
  "why_it_exists": "Bad downside discipline compounds faster than missed upside.",
  "applies_to": "Deals, hiring, and major commitments",
  "priority": "critical",
  "approved_for_retrieval": true
}
